{
  "spec_id": "simulation_v1",
  "version": "1.2",
  "schema_version": "1.0.0",
  "description": "Master simulation loop configuration and victory rules.",
  "game_loop_config": {
    "mode": "hybrid_ticks",
    "ticks_per_turn": 10,
    "max_turns": 500,
    "simulation_speed_multiplier": 1.0
  },
  "victory_conditions": {
    "conquest": { "active": true, "requirement": "eliminate_factions" }
  },
  "god_tools": {
    "brush_sizes": [1, 3, 5],
    "allowed_mutations": ["terrain", "feature", "building"]
  },
  "performance_targets": {
    "target_tick_ms": 16,
    "warning_threshold_ms": 100
  }
}
